{
  "card_title": "Bone and joint manifestations of hypothyroidism",
  "card_year": 1995,
  "comparison_result": "match",
  "identifier_type": "pmid",
  "identifier_value": "7740308",
  "identity_only_disclaimer": "Identifier resolution proves bibliographic identity only; it does not prove that the card summary supports any medical claim.",
  "literature_id": "lit-0115",
  "manual_override_reason": null,
  "notes": "",
  "registry": "ncbi_pubmed",
  "registry_response_excerpt": {
    "doi": "10.1016/s0049-0172(95)80038-7",
    "pmid": "7740308",
    "pubdate": "1995 Feb",
    "source": "Semin Arthritis Rheum",
    "title": "Bone and joint manifestations of hypothyroidism."
  },
  "resolved_container": "Semin Arthritis Rheum",
  "resolved_title": "Bone and joint manifestations of hypothyroidism.",
  "resolved_year": 1995,
  "schema_version": "1.0.0",
  "title_similarity": 1.0,
  "user_agent": "Drift0rResearchPortfolio/0.1 (educational literature identity checks; local research project; no clinical use)",
  "verified_at": "2026-08-05T05:26:03Z",
  "year_delta": 0
}
