{
  "card_title": "WNT1 Mutations in Early-Onset Osteoporosis and Osteogenesis Imperfecta",
  "card_year": 2013,
  "comparison_result": "match",
  "identifier_type": "pmcid",
  "identifier_value": "PMC3709450",
  "identity_only_disclaimer": "Identifier resolution proves bibliographic identity only; it does not prove that the card summary supports any medical claim.",
  "literature_id": "lit-0287",
  "manual_override_reason": null,
  "notes": "",
  "registry": "ncbi_pmc",
  "registry_response_excerpt": {
    "doi": "10.1056/NEJMoa1215458",
    "pmcid": "PMC3709450",
    "pmid": "23656646",
    "source": "N Engl J Med",
    "title": "WNT1 mutations in early-onset osteoporosis and osteogenesis imperfecta.",
    "year": 2013
  },
  "resolved_container": "N Engl J Med",
  "resolved_title": "WNT1 mutations in early-onset osteoporosis and osteogenesis imperfecta.",
  "resolved_year": 2013,
  "schema_version": "1.0.0",
  "title_similarity": 1.0,
  "user_agent": "Drift0rResearchPortfolio/0.1 (educational literature identity checks; local research project; no clinical use)",
  "verified_at": "2026-08-05T20:22:29Z",
  "year_delta": 0
}
