{
  "card_title": "Musculoskeletal manifestations of cat scratch disease",
  "card_year": 2007,
  "comparison_result": "match",
  "identifier_type": "pmid",
  "identifier_value": "18190312",
  "identity_only_disclaimer": "Identifier resolution proves bibliographic identity only; it does not prove that the card summary supports any medical claim.",
  "literature_id": "lit-0037",
  "manual_override_reason": null,
  "notes": "",
  "registry": "ncbi_pubmed",
  "registry_response_excerpt": {
    "doi": "10.1086/523587",
    "pmid": "18190312",
    "pubdate": "2007 Dec 15",
    "source": "Clin Infect Dis",
    "title": "Musculoskeletal manifestations of cat scratch disease."
  },
  "resolved_container": "Clin Infect Dis",
  "resolved_title": "Musculoskeletal manifestations of cat scratch disease.",
  "resolved_year": 2007,
  "schema_version": "1.0.0",
  "title_similarity": 1.0,
  "user_agent": "Drift0rResearchPortfolio/0.1 (educational literature identity checks; local research project; no clinical use)",
  "verified_at": "2026-08-05T05:25:44Z",
  "year_delta": 0
}
