{
  "card_title": "Osteoporosis in men: an Endocrine Society clinical practice guideline",
  "card_year": 2012,
  "comparison_result": "match",
  "identifier_type": "doi",
  "identifier_value": "10.1210/jc.2011-3045",
  "identity_only_disclaimer": "Identifier resolution proves bibliographic identity only; it does not prove that the card summary supports any medical claim.",
  "literature_id": "lit-0001",
  "manual_override_reason": null,
  "notes": "",
  "registry": "crossref",
  "registry_response_excerpt": {
    "DOI": "10.1210/jc.2011-3045",
    "title": "Osteoporosis in Men: An Endocrine Society Clinical Practice Guideline",
    "type": "journal-article",
    "year": 2012
  },
  "resolved_container": "The Journal of Clinical Endocrinology &amp; Metabolism",
  "resolved_title": "Osteoporosis in Men: An Endocrine Society Clinical Practice Guideline",
  "resolved_year": 2012,
  "schema_version": "1.0.0",
  "title_similarity": 1.0,
  "user_agent": "Drift0rResearchPortfolio/0.1 (educational literature identity checks; local research project; no clinical use)",
  "verified_at": "2026-08-05T05:25:36Z",
  "year_delta": 0
}
