{
  "card_title": "Reference Intervals for Serum Concentrations of Three Bone Turnover Markers for Men and Women",
  "card_year": 2013,
  "comparison_result": "match",
  "identifier_type": "pmid",
  "identifier_value": "24076251",
  "identity_only_disclaimer": "Identifier resolution proves bibliographic identity only; it does not prove that the card summary supports any medical claim.",
  "literature_id": "lit-0297",
  "manual_override_reason": null,
  "notes": "",
  "registry": "ncbi_pubmed",
  "registry_response_excerpt": {
    "doi": "10.1016/j.bone.2013.09.010",
    "pmid": "24076251",
    "pubdate": "2013 Dec",
    "source": "Bone",
    "title": "Reference intervals for serum concentrations of three bone turnover markers for men and women."
  },
  "resolved_container": "Bone",
  "resolved_title": "Reference intervals for serum concentrations of three bone turnover markers for men and women.",
  "resolved_year": 2013,
  "schema_version": "1.0.0",
  "title_similarity": 1.0,
  "user_agent": "Drift0rResearchPortfolio/0.1 (educational literature identity checks; local research project; no clinical use)",
  "verified_at": "2026-08-05T05:26:42Z",
  "year_delta": 0
}
