{
  "card_title": "Clinical Practice Guidelines by the Infectious Diseases Society of America (IDSA): 2020 Guideline on Diagnosis and Management of Babesiosis",
  "card_year": 2021,
  "comparison_result": "match",
  "identifier_type": "doi",
  "identifier_value": "10.1093/cid/ciaa1216",
  "identity_only_disclaimer": "Identifier resolution proves bibliographic identity only; it does not prove that the card summary supports any medical claim.",
  "literature_id": "lit-0057",
  "manual_override_reason": null,
  "notes": "",
  "registry": "crossref",
  "registry_response_excerpt": {
    "DOI": "10.1093/cid/ciaa1216",
    "title": "Clinical Practice Guidelines by the Infectious Diseases Society of America (IDSA): 2020 Guideline on Diagnosis and Management of Babesiosis",
    "type": "journal-article",
    "year": 2021
  },
  "resolved_container": "Clinical Infectious Diseases",
  "resolved_title": "Clinical Practice Guidelines by the Infectious Diseases Society of America (IDSA): 2020 Guideline on Diagnosis and Management of Babesiosis",
  "resolved_year": 2021,
  "schema_version": "1.0.0",
  "title_similarity": 1.0,
  "user_agent": "Drift0rResearchPortfolio/0.1 (educational literature identity checks; local research project; no clinical use)",
  "verified_at": "2026-08-05T05:25:51Z",
  "year_delta": 0
}
